{
  "schema": "ark.competitive-benchmark-corpus.v1",
  "version": "1.0.0",
  "description": "Cross-module golden cases for ARK Workbench competitive gates",
  "cases": [
    {
      "id": "competitive-01",
      "module_id": "project-audit-ledger",
      "action_id": "project-audit-ledger.golden.action.1",
      "step_id": "golden.step.1",
      "tenant_id": "tenant-primary",
      "role": "admin",
      "environment": "mobile",
      "outcome": "failed",
      "severity": "critical",
      "expected_detected": true,
      "expected_category": "csrf",
      "evidence_text": "CSRF token mismatch returned HTTP 419 after form submission"
    },
    {
      "id": "competitive-02",
      "module_id": "guidance",
      "action_id": "guidance.golden.action.2",
      "step_id": "golden.step.2",
      "tenant_id": "tenant-secondary",
      "role": "counselor",
      "environment": "desktop",
      "outcome": "failed",
      "severity": "critical",
      "expected_detected": true,
      "expected_category": "permission",
      "evidence_text": "Access denied 403: counselor has no permission for this case"
    },
    {
      "id": "competitive-03",
      "module_id": "guidance",
      "action_id": "guidance.golden.action.3",
      "step_id": "golden.step.3",
      "tenant_id": "tenant-primary",
      "role": "counselor",
      "environment": "api",
      "outcome": "failed",
      "severity": "critical",
      "expected_detected": true,
      "expected_category": "tenant_isolation",
      "evidence_text": "Cross-tenant case record exposed; tenant isolation leak detected"
    },
    {
      "id": "competitive-04",
      "module_id": "project-audit-ledger",
      "action_id": "project-audit-ledger.golden.action.4",
      "step_id": "golden.step.4",
      "tenant_id": "tenant-secondary",
      "role": "admin",
      "environment": "mobile",
      "outcome": "failed",
      "severity": "critical",
      "expected_detected": true,
      "expected_category": "navigation",
      "evidence_text": "Broken navigation: sidebar link route returned 404"
    },
    {
      "id": "competitive-05",
      "module_id": "wms",
      "action_id": "wms.golden.action.5",
      "step_id": "golden.step.5",
      "tenant_id": "tenant-primary",
      "role": "manager",
      "environment": "desktop",
      "outcome": "failed",
      "severity": "critical",
      "expected_detected": true,
      "expected_category": "db",
      "evidence_text": "SQL error: inventory table does not exist after schema drift"
    },
    {
      "id": "competitive-06",
      "module_id": "ehr",
      "action_id": "ehr.golden.action.6",
      "step_id": "golden.step.6",
      "tenant_id": "tenant-secondary",
      "role": "clinician",
      "environment": "api",
      "outcome": "failed",
      "severity": "critical",
      "expected_detected": true,
      "expected_category": "capability",
      "evidence_text": "Capability not registered; no provider for patient result access"
    },
    {
      "id": "competitive-07",
      "module_id": "project-audit-ledger",
      "action_id": "project-audit-ledger.golden.action.7",
      "step_id": "golden.step.7",
      "tenant_id": "tenant-primary",
      "role": "admin",
      "environment": "mobile",
      "outcome": "failed",
      "severity": "major",
      "expected_detected": true,
      "expected_category": "workflow",
      "evidence_text": "Invalid transition: workflow state remained draft after submit"
    },
    {
      "id": "competitive-08",
      "module_id": "project-audit-ledger",
      "action_id": "project-audit-ledger.golden.action.8",
      "step_id": "golden.step.8",
      "tenant_id": "tenant-secondary",
      "role": "admin",
      "environment": "desktop",
      "outcome": "failed",
      "severity": "major",
      "expected_detected": true,
      "expected_category": "effect",
      "evidence_text": "Expected effect missing: approval row not created and status unchanged"
    },
    {
      "id": "competitive-09",
      "module_id": "wms",
      "action_id": "wms.golden.action.9",
      "step_id": "golden.step.9",
      "tenant_id": "tenant-primary",
      "role": "manager",
      "environment": "api",
      "outcome": "failed",
      "severity": "major",
      "expected_detected": true,
      "expected_category": "event",
      "evidence_text": "Domain event not fired and listener not executed for stock transfer"
    },
    {
      "id": "competitive-10",
      "module_id": "ehr",
      "action_id": "ehr.golden.action.10",
      "step_id": "golden.step.10",
      "tenant_id": "tenant-secondary",
      "role": "clinician",
      "environment": "mobile",
      "outcome": "failed",
      "severity": "major",
      "expected_detected": true,
      "expected_category": "audit",
      "evidence_text": "Audit not written; no audit record for protected chart access"
    },
    {
      "id": "competitive-11",
      "module_id": "guidance",
      "action_id": "guidance.golden.action.11",
      "step_id": "golden.step.11",
      "tenant_id": "tenant-primary",
      "role": "counselor",
      "environment": "desktop",
      "outcome": "failed",
      "severity": "major",
      "expected_detected": true,
      "expected_category": "accessibility",
      "evidence_text": "Accessible name missing and keyboard trap found in appointment dialog"
    },
    {
      "id": "competitive-12",
      "module_id": "guidance",
      "action_id": "guidance.golden.action.12",
      "step_id": "golden.step.12",
      "tenant_id": "tenant-secondary",
      "role": "encoder",
      "environment": "api",
      "outcome": "failed",
      "severity": "major",
      "expected_detected": true,
      "expected_category": "validation",
      "evidence_text": "Validation failed 422: required field must be a valid date"
    },
    {
      "id": "competitive-13",
      "module_id": "wms",
      "action_id": "wms.golden.action.13",
      "step_id": "golden.step.13",
      "tenant_id": "tenant-primary",
      "role": "manager",
      "environment": "mobile",
      "outcome": "failed",
      "severity": "major",
      "expected_detected": true,
      "expected_category": "missing_record",
      "evidence_text": "Record not found 404; referenced inventory batch does not exist"
    },
    {
      "id": "competitive-14",
      "module_id": "wms",
      "action_id": "wms.golden.action.14",
      "step_id": "golden.step.14",
      "tenant_id": "tenant-secondary",
      "role": "manager",
      "environment": "desktop",
      "outcome": "failed",
      "severity": "major",
      "expected_detected": true,
      "expected_category": "network",
      "evidence_text": "Network error: connection refused and request timeout"
    },
    {
      "id": "competitive-15",
      "module_id": "ehr",
      "action_id": "ehr.golden.action.15",
      "step_id": "golden.step.15",
      "tenant_id": "tenant-primary",
      "role": "clinician",
      "environment": "api",
      "outcome": "failed",
      "severity": "major",
      "expected_detected": true,
      "expected_category": "session",
      "evidence_text": "Session expired; login required and user not authenticated"
    },
    {
      "id": "competitive-16",
      "module_id": "guidance",
      "action_id": "guidance.golden.action.16",
      "step_id": "golden.step.16",
      "tenant_id": "tenant-secondary",
      "role": "admin",
      "environment": "mobile",
      "outcome": "failed",
      "severity": "major",
      "expected_detected": true,
      "expected_category": "template",
      "evidence_text": "DiSyL template render error: undefined variable"
    },
    {
      "id": "competitive-17",
      "module_id": "project-audit-ledger",
      "action_id": "project-audit-ledger.golden.action.17",
      "step_id": "golden.step.17",
      "tenant_id": "tenant-primary",
      "role": "admin",
      "environment": "desktop",
      "outcome": "failed",
      "severity": "minor",
      "expected_detected": true,
      "expected_category": "flaky",
      "evidence_text": "Intermittent browser click passes on retry; flaky nondeterministic behavior"
    },
    {
      "id": "competitive-18",
      "module_id": "wms",
      "action_id": "wms.golden.action.18",
      "step_id": "golden.step.18",
      "tenant_id": "tenant-secondary",
      "role": "manager",
      "environment": "api",
      "outcome": "failed",
      "severity": "minor",
      "expected_detected": true,
      "expected_category": "environment",
      "evidence_text": "Probe error: database unreachable because environment unavailable"
    },
    {
      "id": "competitive-19",
      "module_id": "guidance",
      "action_id": "guidance.golden.action.19",
      "step_id": "golden.step.19",
      "tenant_id": "tenant-primary",
      "role": "admin",
      "environment": "mobile",
      "outcome": "failed",
      "severity": "major",
      "expected_detected": true,
      "expected_category": "performance",
      "evidence_text": "Performance budget failed: slow response and latency exceeded"
    },
    {
      "id": "competitive-20",
      "module_id": "ehr",
      "action_id": "ehr.golden.action.20",
      "step_id": "golden.step.20",
      "tenant_id": "tenant-secondary",
      "role": "admin",
      "environment": "desktop",
      "outcome": "failed",
      "severity": "major",
      "expected_detected": true,
      "expected_category": "dependency",
      "evidence_text": "Undeclared dependency: companion module provider unavailable"
    },
    {
      "id": "competitive-21",
      "module_id": "wms",
      "action_id": "wms.golden.action.21",
      "step_id": "golden.step.21",
      "tenant_id": "tenant-primary",
      "role": "manager",
      "environment": "api",
      "outcome": "failed",
      "severity": "major",
      "expected_detected": true,
      "expected_category": "integration",
      "evidence_text": "Provider contract mismatch: integration response schema mismatch"
    },
    {
      "id": "competitive-22",